<!--
  ~ XMLRSS - A Java Crypto Provider for Redactable Signatures and their
  ~ XML Signature encoding.
  ~
  ~ Copyright (c) 2017 Wolfgang Popp
  ~
  ~ This program is free software: you can redistribute it and/or modify
  ~ it under the terms of the GNU General Public License as published by
  ~ the Free Software Foundation, either version 3 of the License, or
  ~ (at your option) any later version.
  ~
  ~ This program is distributed in the hope that it will be useful,
  ~ but WITHOUT ANY WARRANTY; without even the implied warranty of
  ~ MERCHANTABILITY or FITNESS FOR A PARTICULAR PURPOSE.  See the
  ~ GNU General Public License for more details.
  ~
  ~ You should have received a copy of the GNU General Public License
  ~ along with this program.  If not, see <http://www.gnu.org/licenses/>.
  -->

<!ELEMENT Vehicle (Aircraft | Watercraft | MotorVehicles | Signature)+>
<!ELEMENT Aircraft (Glider | Jet)+>
<!ELEMENT Watercraft (Sailboat | Motorboat)+>
<!ELEMENT MotorVehicles (Car | Motorcycle)+>
<!ELEMENT Glider (#PCDATA)>
<!ELEMENT Jet (#PCDATA)>
<!ELEMENT Motorboat (#PCDATA)>
<!ELEMENT Sailboat (#PCDATA)>
<!ELEMENT Motorcycle (#PCDATA)>
<!ELEMENT Car (#PCDATA)>
<!ELEMENT Signature ANY>

<!ATTLIST Aircraft id ID #IMPLIED>
<!ATTLIST Watercraft id ID #IMPLIED>
<!ATTLIST MotorVehicles id ID #IMPLIED>
<!ATTLIST Jet id ID #IMPLIED>
<!ATTLIST Glider id ID #IMPLIED>
<!ATTLIST Car Brand CDATA #REQUIRED
        Model CDATA #REQUIRED>
<!ATTLIST Motorcycle Brand CDATA #REQUIRED
        Model CDATA #REQUIRED>
